{
  "schema_version": "1.0.0",
  "event_id": "event:reminder:001",
  "occurred_at": "2026-07-19T10:55:00+08:00",
  "source": "electron_main",
  "payload": {
    "kind": "reminder",
    "priority": "critical",
    "text": "五分钟后参加项目会议。",
    "actions": [
      {
        "action_id": "companion.reminder.acknowledge",
        "label": "知道了",
        "style": "primary"
      }
    ],
    "requires_ack": true,
    "expires_at": null,
    "revision": 1
  }
}
